question,current_response_time,new_response_time,improvement_seconds,improvement_percentage,response_length,search_limitations,expected_behavior,search_number,timestamp
tell me the latest share price performance of ADNOC and its competitors,12.40206s,5.40679669380188,6.995263306198121,56.40404341051502,495,[],Should provide real-time search results with citations,1,2025-08-05T11:08:40.510568
Investigate ESG best practices within the shipping and integrated logistics sector (for Navig8 & ZMI Holdings,14.39878s,4.92767858505249,9.47110141494751,65.77711038676549,1549,[],Should provide real-time search results with citations,1,2025-08-05T11:08:48.691642
Examine recent reports or studies on carbon footprint effectiveness in UAE-based projects.,15.1257s,6.325044870376587,8.800655129623413,58.183456829260216,1405,[],Should provide real-time search results with citations,1,2025-08-05T11:08:58.246165
Research industry benchmarks and strategies for enhancing working capital management,12.512791550159454s,7.299758672714233,5.213032877445221,41.661629673506305,1505,[],Should provide real-time search results with citations,1,2025-08-05T11:09:08.846750
"Research industry benchmarks and best practices for ensuring defensive revenue, particularly in shipping and logistics and infrastructure sectors",12.874236345291138s,10.49118709564209,2.383049249649048,18.510218281961777,1975,[],Should provide real-time search results with citations,1,2025-08-05T11:09:22.709572
"Get competitor benchmarking data comparing ADNOC's performance with Aramco, Shell, and other key players post-acquisition",14.367826581001282s,6.370894193649292,7.99693238735199,55.6586087830877,1379,[],Should provide real-time search results with citations,1,2025-08-05T11:09:32.953223
Pull industry analysis reports to understand the broader trends affecting the competitive positioning of ADNOC post-acquisition,14.627501106262207s,5.892006874084473,8.735494232177734,59.71966208526188,1468,[],Should provide real-time search results with citations,1,2025-08-05T11:09:42.116905
Research industry best practices for efficiency improvement in shipping and logistics project,13.831694105693272s,5.867632627487183,7.964061478206089,57.57835169972416,1647,[],Should provide real-time search results with citations,1,2025-08-05T11:09:51.219230
Research regional market diversification trends in the shipping and logistics sector,13.767988030115763s,8.94033169746399,4.827656332651774,35.06435596901941,1807,[],Should provide real-time search results with citations,1,2025-08-05T11:10:03.459558
Identify any technological disruptions affecting the shipping and tanker pooling industry,13.673103332519531s,5.640920162200928,8.032183170318604,58.744404799568784,1257,[],Should provide real-time search results with citations,1,2025-08-05T11:10:12.299417
Research performance benchmarks or indicators for board member evaluation,13.990270459651947s,4.7315099239349365,9.25876053571701,66.17999675145202,1297,[],Should provide real-time search results with citations,1,2025-08-05T11:10:20.311618
Pull industry analysis reports to understand the broader trends affecting the competitive positioning of ADNOC post-acquisition,14.627501106262207s,4.813765525817871,9.813735580444336,67.09099188680258,1193,[],Should provide real-time search results with citations,1,2025-08-05T11:10:28.828570
Research competitive benchmarks for replicating capabilities like commercial pooling and digital platforms within ADNOC key subsidiaries,14.31508457660675s,6.746056318283081,7.569028258323669,52.8744920633772,1318,[],Should provide real-time search results with citations,1,2025-08-05T11:10:38.803019
Research recent geopolitical or economic events affecting shipping and supply chain industry in the UAE,14.11686733563741s,8.654418468475342,5.462448867162069,38.694483253889885,2151,[],Should provide real-time search results with citations,1,2025-08-05T11:10:50.905044
"Research global bunker trading capabilities, pooling, and digital chartering platform benchmarks to determine replicability within three years.",14.307269633900036s,4.715407371520996,9.59186226237904,67.04187806492315,1200,[],Should provide real-time search results with citations,1,2025-08-05T11:10:58.855957
